<?xml version="1.0" encoding="iso-8859-1"?>
<?xml-model href="libraryRefLocalIndex.sch" type="application/xml" schematypens="http://purl.oclc.org/dsdl/schematron"?>
<library xmlns:xsi="http://www.w3.org/2001/XMLSchema-instance"
	xsi:noNamespaceSchemaLocation="libraryNormalized.xsd">
	<book>
		<isbn>0836217462</isbn>
		<title>Being a Dog Is a Full-Time Job</title>
		<author>Charles M. Schulz</author>
		<!-- Doppelter Autorenname nicht erlaubt.
		<author>Charles M. Schulz</author>
		-->
		<character>Peppermint Patty</character>
		<character>Snoopy</character>
		<character>Schroeder</character>
		<character>Lucy</character>
	</book>
	<book>
		<isbn>0805033106</isbn>
		<title>Peanuts Every Sunday </title>
		<author>Charles M. Schulz</author>
		<character>Snoopy</character>
		<character>Sally Brown</character>
		<!-- Doppelter Character-Wert nicht erlaubt.
		<character>Snoopy</character>
		-->
		<character>Linus</character>
		<character>Lucy</character>
	</book>

	<author>
		<name>Charles M. Schulz</name>
		<nickName>SPARKY</nickName>
		<born>November 26, 1922</born>
		<dead>February 12, 2000</dead>
	</author>
	
	<character>
		<name>Snoopy</name>
		<since>October 4, 1950</since>
		<qualification>extroverted beagle</qualification>
	</character>
	<character>
		<name>Sally Brown</name>
		<since>Aug, 22, 1960</since>
		<qualification>always looks for the easy way out</qualification>
	</character>
	<character>
		<name>Linus</name>
		<since>Sept. 19, 1952</since>
		<qualification>the intellectual of the gang</qualification>
	</character>
	<character>
		<name>Lucy</name>
		<since>March 3, 1952</since>
		<qualification>bossy, crabby and selfish</qualification>
	</character>
	<character>
		<name>Schroeder</name>
		<since>May 30, 1951</since>
		<qualification>brought classical music to the Peanuts strip</qualification>
	</character>
	<character>
		<name>Peppermint Patty</name>
		<since>Aug. 22, 1966</since>
		<qualification>bold, brash and tomboyish</qualification>
	</character>
	<!-- author und character können den gleichen Schlüsselwert haben (separate Indexe) -->
	<character>
		<name>Charles M. Schulz</name>
		<since>November 26, 1922</since>
		<qualification>creative</qualification>
	</character>
	
	<comments>
		<characterRef book="0805033106" character="Snoopy"/>
		<characterRef book="0805033106" character="Snoopy"/>
		<characterRef book="0836217462" character="Snoopy"/>
		<characterRef book="0836217462" character="Schroeder"/>
		<!-- Dangling references, Verstoß gegen referentielle Integrität (durch Schematron!)
		<characterRef book="0805033106" character="Haegar"/>
		<characterRef book="0805033106" character="Peppermint Patty"/>
		-->
	</comments>
</library>
